{
  "schema_version": 1,
  "id": "high-refresh-independent-gpu-4",
  "kind": "GpuScene",
  "params": {
    "composition": "UiOnly",
    "viewport": [
      1920,
      1080
    ],
    "host_texture": {
      "slot": "content",
      "width": 640,
      "height": 32
    },
    "ui_nodes": [
      "list",
      "text",
      "gpu-texture-view",
      "text",
      "gpu-texture-view",
      "text",
      "gpu-texture-view",
      "text",
      "gpu-texture-view",
      "button"
    ],
    "independent_textures": true
  },
  "notes": "1080p offscreen diagnostic: 4 independent textures/producers, interleaved text and a button. Producer GPU timestamps bracket all producer passes; UI composition is timed separately. All use one encoder and submit. No Surface intervals."
}
