{
  "schema_version": 1,
  "id": "static-tree-10k",
  "kind": "StaticTree",
  "params": {
    "nodes": 10000
  },
  "record": [
    "construction",
    "reconciliation",
    "style",
    "text_shaping",
    "layout",
    "render_extraction",
    "render_encode",
    "memory",
    "allocations"
  ],
  "invariants": [
    {
      "name": "static_ui",
      "path": "metrics.frames_after_idle",
      "op": "eq",
      "value": 0,
      "status": "required",
      "note": "See perf/README.md §8.1 for the frames_after_idle definition. Missing stays not-evaluable, never 0."
    }
  ],
  "notes": "§8.1 static_ui judged when frames_after_idle is present. static-tree-50k stays unsupported."
}
