{
  "schema_version": 1,
  "id": "virtual-list-1m",
  "kind": "VirtualList",
  "params": {
    "items": 1000000,
    "visible": 40,
    "overscan": 8,
    "text_len": 32,
    "item_extent_px": 20
  },
  "record": [
    "scroll_cpu",
    "live_ui_entities",
    "work_counters"
  ],
  "invariants": [
    {
      "name": "virtual_list_1m_live_entities_bounded",
      "path": "work_counters.live_ui_entities",
      "op": "lte",
      "value": 64,
      "status": "required",
      "note": "Issue #8 §3.4 forbids one retained entity per logical row. 1M is env-gated (NANA_PERF_SCALE=large); missing or skipped reports stay not-evaluable / unsupported."
    }
  ]
}
